{
  "_id": "FLOW1001",
  "name": "Test Flow",
  "options": {
    "uniqueTxnID": true
  },
  "inputStage": {
    "type": "API",
    "name": "Get Data",
    "incoming": {
      "path": "/mapper",
      "method": "POST",
      "headers": {
        "Content-Type": [
          "application/json"
        ]
      }
    },
    "onSuccess": [
      {
        "_id": "STAGE1001"
      }
    ],
    "onError": [],
    "dataStructure": {
      "outgoing": {
        "type": "dataFormat",
        "_id": "DF1001"
      }
    }
  },
  "stages": [
    {
      "_id": "STAGE1001",
      "name": "Convert from DF1001 to DF1003",
      "type": "TRANSFORM",
      "onSuccess": [
        {
          "_id": "STAGE1002"
        }
      ],
      "onError": [],
      "mapping": [
        {
          "source": [
            {
              "type": "String",
              "dataPath": "_id"
            }
          ],
          "target": {
            "type": "String",
            "dataPath": "_id"
          },
          "formula": "return input1"
        },
        {
          "source": [
            {
              "type": "String",
              "dataPath": "name"
            }
          ],
          "target": {
            "type": "String",
            "dataPath": "name"
          },
          "formula": "return input1"
        },
        {
          "source": [
            {
              "type": "String",
              "dataPath": "email"
            }
          ],
          "target": {
            "type": "String",
            "dataPath": "email"
          },
          "formula": "return input1"
        },
        {
          "source": [
            {
              "type": "Number",
              "dataPath": "contactNo"
            }
          ],
          "target": {
            "type": "Number",
            "dataPath": "contactNo"
          },
          "formula": "return input1"
        },
        {
          "source": [
            {
              "type": "Number",
              "dataPath": "age"
            }
          ],
          "target": {
            "type": "Number",
            "dataPath": "age"
          },
          "formula": "return input1"
        }
      ],
      "dataStructure": {
        "outgoing": {
          "type": "dataFormat",
          "_id": "DF1002"
        }
      }
    },
    {
      "_id": "STAGE1002",
      "name": "Call external API",
      "type": "API",
      "outgoing": {
        "url": "http://localhost:18080/api/mapper/stage2",
        "method": "POST",
        "headers": {
          "Content-Type": "application/json"
        }
      },
      "dataStructure": {
        "outgoing": {
          "type": "dataFormat",
          "_id": "DF1003"
        }
      },
      "onSuccess": [
        {
          "_id": "STAGE1003"
        }
      ],
      "onError": []
    },
    {
      "_id": "STAGE1003",
      "name": "Response Node",
      "type": "RESPONSE",
      "dataStructure": {
        "outgoing": {
          "type": "dataFormat",
          "_id": "DF1001"
        }
      },
      "onSuccess": [],
      "onError": []
    }
  ],
  "error": [],
  "dataStructures": {
    "DF1001": {
      "name": "Some Structure",
      "definition": [
        {
          "key": "_id",
          "type": "String",
          "prefix": "EMP",
          "suffix": null,
          "padding": null,
          "counter": 1001,
          "properties": {
            "name": "ID",
            "required": false,
            "dataPath": "_id"
          }
        },
        {
          "type": "String",
          "key": "name",
          "properties": {
            "name": "Name",
            "dataPath": "name"
          }
        },
        {
          "type": "String",
          "key": "email",
          "properties": {
            "name": "Email",
            "dataPath": "email"
          }
        },
        {
          "type": "String",
          "key": "contactNo",
          "properties": {
            "name": "Contact No",
            "dataPath": "contactNo"
          }
        },
        {
          "type": "Number",
          "key": "age",
          "properties": {
            "name": "Age",
            "precision": 2,
            "dataPath": "age"
          }
        }
      ]
    },
    "DF1002": {
      "name": "Some Structure",
      "definition": [
        {
          "key": "_id",
          "type": "String",
          "prefix": "EMP",
          "suffix": null,
          "padding": null,
          "counter": 1001,
          "properties": {
            "name": "ID",
            "required": false,
            "dataPath": "_id"
          }
        },
        {
          "type": "String",
          "key": "name",
          "properties": {
            "name": "Name",
            "dataPath": "name"
          }
        },
        {
          "type": "String",
          "key": "email",
          "properties": {
            "name": "Email",
            "dataPath": "email"
          }
        },
        {
          "type": "String",
          "key": "contactNo",
          "properties": {
            "name": "Contact No",
            "dataPath": "contactNo"
          }
        },
        {
          "type": "Number",
          "key": "age",
          "properties": {
            "name": "Age",
            "precision": 2,
            "dataPath": "age"
          }
        }
      ]
    },
    "DF1003": {
      "name": "Some Structure",
      "definition": [
        {
          "key": "_id",
          "type": "String",
          "prefix": "EMP",
          "suffix": null,
          "padding": null,
          "counter": 1001,
          "properties": {
            "name": "ID",
            "required": false,
            "dataPath": "_id"
          }
        },
        {
          "type": "String",
          "key": "name",
          "properties": {
            "name": "Name",
            "dataPath": "name"
          }
        },
        {
          "type": "String",
          "key": "email",
          "properties": {
            "name": "Email",
            "dataPath": "email"
          }
        },
        {
          "type": "String",
          "key": "contactNo",
          "properties": {
            "name": "Contact No",
            "dataPath": "contactNo"
          }
        },
        {
          "type": "Number",
          "key": "age",
          "properties": {
            "name": "Age",
            "precision": 2,
            "dataPath": "age"
          }
        }
      ]
    }
  }
}